{
  "version": 1,
  "genere": "2026-10-16T16:21:04Z",
  "id": 226880,
  "numero": "23_HQU_51",
  "type": "Question orale",
  "statut": {
    "libelle": "Terminée",
    "date": "2023-06-13"
  },
  "depose": "2023-06-06",
  "titre": "Une action humanitaire en faveur des victimes du séisme en Turquie entravée par la BCV ?",
  "contributeurs": [
    {
      "nom": "Hadrien Buclin",
      "parti": "EP",
      "role": "Auteur",
      "sorte": "personne"
    }
  ],
  "etapes": [
    {
      "date": "2023-06-06",
      "libelle": "Eingereicht"
    },
    {
      "date": "2023-06-13",
      "libelle": "Erledigt"
    }
  ],
  "documents": [],
  "lien": "https://www.vd.ch/gc/seances-du-grand-conseil/point-seance/point/cc670191-8c91-40ad-b479-71b4fbe03b07/meeting/1013648",
  "communes": []
}
