{
  "version": 1,
  "genere": "2026-10-16T16:21:04Z",
  "id": 226621,
  "numero": "22_PET_4",
  "type": "Pétition",
  "statut": {
    "libelle": "Classée",
    "date": "2022-05-10"
  },
  "depose": "2022-05-10",
  "titre": "Pétition concernant un incendie à Nonfoux",
  "contributeurs": [],
  "etapes": [
    {
      "date": "2022-05-10",
      "libelle": "Eingereicht"
    }
  ],
  "documents": [
    {
      "titre": "Visionner le débat de ce point à l'ordre du jour",
      "date": "2023-03-28",
      "lien": "https://www.sonomix.ch/live/gcvd/2341#10285"
    }
  ],
  "lien": "https://www.vd.ch/gc/seances-du-grand-conseil/point-seance/point/b1731405-b81a-48cf-af21-873840c0d733/meeting/1013639",
  "communes": []
}
