{
  "version": 1,
  "genere": "2026-10-17T05:02:22Z",
  "id": 224380,
  "numero": "18_LEG_352",
  "type": "Décret/Loi",
  "statut": {
    "libelle": "Adopté",
    "date": "2018-05-22"
  },
  "depose": "2018-02-13",
  "titre": "Exposé des motifs et projet de loi modifiant la loi sur les communes du 28 février 1956 (LC) et Rapport du Conseil d'Etat au Grand Conseil sur la motion Jacques Haldy et consorts « pour permettre la vente par les communes des biens abandonnés par un locataire expulsé »",
  "contributeurs": [
    {
      "nom": "Jessica Jaccoud",
      "parti": "SOC",
      "role": "Rapporteur de la commission",
      "sorte": "personne"
    },
    {
      "nom": "Jessica Jaccoud",
      "parti": null,
      "role": null,
      "sorte": "groupe"
    },
    {
      "nom": "Jessica Jaccoud",
      "parti": "SOC",
      "role": "Rapporteur de la commission",
      "sorte": "personne"
    }
  ],
  "etapes": [
    {
      "date": "2018-02-13",
      "libelle": "Déposé"
    },
    {
      "date": "2018-05-22",
      "libelle": "Adopté"
    }
  ],
  "documents": [
    {
      "titre": "Rapport de la commission",
      "date": "2018-02-13",
      "lien": "https://www.vd.ch/fileadmin/user_upload/organisation/gc/fichiers_pdf/2017-2022/352_RC.pdf"
    },
    {
      "titre": "Texte adopté par le Conseil d'Etat",
      "date": "2018-02-13",
      "lien": "https://www.vd.ch/fileadmin/user_upload/organisation/gc/fichiers_pdf/2012-2017/352_TexteCE.pdf"
    }
  ],
  "lien": "https://www.vd.ch/gc/seances-precedentes/annee-2018/seance-du-mardi-22-mai-2018/expose-des-motifs-et-projet-de-loi-modifiant-la-loi-sur-les-communes-du-28-fevrier-1956-lc-et-rapport-du-conseil-detat-au-grand-conseil-sur-la-motion-jacques-haldy-et-consorts-pour-permettre-la-vente-par-les-communes-des-biens-abandonnes-par-un-loca",
  "communes": [
    {
      "ofs": 5586,
      "origine": "document"
    }
  ]
}
