{
  "version": 1,
  "genere": "2026-10-16T16:21:04Z",
  "id": 228983,
  "numero": "21_LEG_7",
  "type": "Décret/Loi",
  "statut": {
    "libelle": "Eingereicht",
    "date": "2022-01-25"
  },
  "depose": "2022-01-25",
  "titre": "EMPD et projet de décret visant à exercer le droit d’initiative du canton en soumettant à l’Assemblée fédérale un projet de modification de la loi fédérale sur l'assurance maladie (LAMal)",
  "contributeurs": [],
  "etapes": [
    {
      "date": "2022-01-25",
      "libelle": "Eingereicht"
    }
  ],
  "documents": [
    {
      "titre": "Visionner le débat de ce point à l'ordre du jour",
      "date": "2022-02-15",
      "lien": "https://www.sonomix.ch/live/gcvd/2057#5046"
    },
    {
      "titre": "EMPD et rapport en réponse à l'initiative Anne-Laure Botteron et consorts - Pour que les fausses couches, les grossesses non évolutives et les grossesses extra-utérines soient remboursées - Texte adopté par CE - EMPD - Initiative Botteron publié",
      "date": "2021-11-03",
      "lien": "https://sieldocs.vd.ch/ecm/app18/service/siel/getContent?ID=2084474"
    }
  ],
  "lien": "https://www.vd.ch/gc/seances-du-grand-conseil/point-seance/point/609fcc2f-0a35-4758-aff0-a7fa65d5c48d/meeting/1004430",
  "communes": []
}
