{
  "version": 1,
  "genere": "2026-10-16T16:21:04Z",
  "id": 340175,
  "numero": "26_QUE_59",
  "type": "Simple question",
  "statut": {
    "libelle": "Eingereicht",
    "date": "2026-09-01"
  },
  "depose": "2026-09-01",
  "titre": "Contrôle de la qualité de l'eau de L'Orbe supérieure",
  "contributeurs": [
    {
      "nom": "Sébastien Cala",
      "parti": "SOC",
      "role": "Auteur",
      "sorte": "personne"
    }
  ],
  "etapes": [
    {
      "date": "2026-09-01",
      "libelle": "Eingereicht"
    }
  ],
  "documents": [],
  "lien": "https://www.vd.ch/gc/seances-du-grand-conseil/point-seance/point/903a46b8-2c3e-4f61-8cbd-56f042c68839/meeting/1033707",
  "communes": []
}
