{
  "version": 1,
  "genere": "2026-10-16T16:21:04Z",
  "id": 228507,
  "numero": "08_INT_050",
  "type": "Interpellation",
  "statut": {
    "libelle": "Renvoyé par manque de temps",
    "date": "2008-08-26"
  },
  "depose": "2008-08-26",
  "titre": "Les coûts pour l'Etat des personnes surendettées ou comment l'Etat finance le petit crédit et autres dettes de consommation",
  "contributeurs": [
    {
      "nom": "Conseil d'État",
      "parti": null,
      "role": null,
      "sorte": "groupe"
    }
  ],
  "etapes": [
    {
      "date": "2008-08-26",
      "libelle": "Eingereicht"
    }
  ],
  "documents": [
    {
      "titre": "Texte adopté par le Conseil d'Etat",
      "date": "2008-08-26",
      "lien": "https://www.vd.ch/fileadmin/user_upload/organisation/gc/Seance_du_02_septembre_2008/08_INT_050_texte_CE.pdf"
    }
  ],
  "lien": "https://www.vd.ch/gc/seances-precedentes/annee-2008/seance-du-26-aout-2008/reponse-du-conseil-detat-a-linterpellation-olivier-epars",
  "communes": [
    {
      "ofs": 5586,
      "origine": "document"
    }
  ]
}
