{
  "version": 1,
  "genere": "2026-10-16T16:21:04Z",
  "id": 227006,
  "numero": "23_INT_159",
  "type": "Interpellation",
  "statut": {
    "libelle": "Adopté",
    "date": "2023-10-31"
  },
  "depose": "2023-10-10",
  "titre": "Quelles nuances de gris pour la Route Blanche et les accès routiers a l’autoroute A1 ?",
  "contributeurs": [
    {
      "nom": "Nathalie Vez",
      "parti": "VER",
      "role": "Auteur",
      "sorte": "personne"
    }
  ],
  "etapes": [
    {
      "date": "2023-10-10",
      "libelle": "Eingereicht"
    },
    {
      "date": "2023-10-31",
      "libelle": "Überwiesen"
    }
  ],
  "documents": [
    {
      "titre": "Visionner le débat de ce point à l'ordre du jour",
      "date": "2023-10-31",
      "lien": "https://www.sonomix.ch/live/gcvd/2625#948"
    },
    {
      "titre": "Visionner le débat de ce point à l'ordre du jour",
      "date": "2024-12-18",
      "lien": "https://www.sonomix.ch/live/gcvd/3000#834"
    }
  ],
  "lien": "https://www.vd.ch/gc/seances-du-grand-conseil/point-seance/point/2d47851a-6429-4d96-894c-b9583be67cb8/meeting/1026873",
  "communes": []
}
