{
  "version": 1,
  "genere": "2026-10-16T16:21:04Z",
  "id": 282664,
  "numero": "POS25/121",
  "type": "Postulat",
  "statut": {
    "libelle": "Décision : Renvoi direct en Municipalité",
    "date": "2025-12-09"
  },
  "depose": "2025-11-04",
  "titre": "Un secteur Benjamin-Constant sécurisé pour les piétons",
  "contributeurs": [
    {
      "nom": "Pauline Blanc",
      "parti": "PLR",
      "role": "Auteur",
      "sorte": "personne"
    }
  ],
  "etapes": [
    {
      "date": "2025-11-04",
      "libelle": "Eingereicht"
    },
    {
      "date": "2025-11-18",
      "libelle": "Décision : Renvoi en Municipalité"
    },
    {
      "date": "2025-12-09",
      "libelle": "Décision : Renvoi direct en Municipalité"
    }
  ],
  "documents": [
    {
      "titre": "Délibéré 10e séance CC du 09.12.2025",
      "date": null,
      "lien": "https://www.lausanne.ch/apps/agir/affaire/doc/1d/1d24f056ff3448268c0a9edf92bd8853.pdf"
    },
    {
      "titre": "Postulat de Blanc Pauline - Un secteur Benjamin-Constant sécurisé pour les piétons",
      "date": null,
      "lien": "https://www.lausanne.ch/apps/agir/affaire/doc/d0/d0578d0d13d64f8c8c6ebead1e0d929e.pdf"
    }
  ],
  "lien": "https://www.lausanne.ch/apps/agir/affaire/87/c7f194e65c8347ea89ebe49da3d3c287.htm",
  "communes": []
}
