{
  "version": 1,
  "genere": "2026-10-16T16:21:04Z",
  "id": 228807,
  "numero": "9_LEG_220",
  "type": "Décret/Loi",
  "statut": {
    "libelle": "Adopté",
    "date": "2009-12-08"
  },
  "depose": "2009-12-01",
  "titre": "Exposé des motifs et projet de décret accordant un crédit d'investissement de CHF 6'590'000.- pour la transformation et le réaménagement du Centre de Dialyse chronique du CHUV, au Bugnon 17 à Lausanne",
  "contributeurs": [
    {
      "nom": "Philippe Martinet",
      "parti": "VER",
      "role": "Rapporteur de la commission",
      "sorte": "personne"
    },
    {
      "nom": "Philippe Martinet",
      "parti": null,
      "role": null,
      "sorte": "groupe"
    }
  ],
  "etapes": [
    {
      "date": "2009-12-01",
      "libelle": "Eingereicht"
    },
    {
      "date": "2009-12-08",
      "libelle": "Angenommen"
    }
  ],
  "documents": [
    {
      "titre": "Texte adopté par le Conseil d'Etat",
      "date": "2009-12-01",
      "lien": "https://www.vd.ch/fileadmin/user_upload/organisation/gc/fichiers_pdf/220_Texte_CE_01.pdf"
    },
    {
      "titre": "Rapport de la commission",
      "date": "2009-12-01",
      "lien": "https://www.vd.ch/fileadmin/user_upload/organisation/gc/fichiers_pdf/220_RC.PDF"
    },
    {
      "titre": "Décret adopté par le Grand Conseil le 08.12.09",
      "date": "2009-12-08",
      "lien": "https://www.vd.ch/fileadmin/user_upload/organisation/gc/fichiers_pdf/220_Decret_adopte_le_08.12.09.pdf"
    }
  ],
  "lien": "https://www.vd.ch/gc/seances-precedentes/annee-2009/seances-des-8-et-9-decembre-2009/expose-des-motifs-et-projet-de-decret-centre-de-dialyse-du-chuv",
  "communes": [
    {
      "ofs": 5586,
      "origine": "titre"
    },
    {
      "ofs": 5890,
      "origine": "document"
    },
    {
      "ofs": 5938,
      "origine": "document"
    },
    {
      "ofs": 5401,
      "origine": "document"
    },
    {
      "ofs": 5822,
      "origine": "document"
    },
    {
      "ofs": 5724,
      "origine": "document"
    },
    {
      "ofs": 5412,
      "origine": "document"
    }
  ]
}
