{
  "version": 1,
  "genere": "2026-10-16T16:21:04Z",
  "id": 227888,
  "numero": "24_POS_42",
  "type": "Postulat",
  "statut": {
    "libelle": "Renvoyée à commission",
    "date": "2024-10-01"
  },
  "depose": "2024-09-24",
  "titre": "Le temps presse pour établir un état des lieux de la précarité étudiante",
  "contributeurs": [
    {
      "nom": "Yannick Maury",
      "parti": "VER",
      "role": "Auteur",
      "sorte": "personne"
    },
    {
      "nom": "Felix Stürner",
      "parti": "VER",
      "role": "Rapporteur(s) de commission",
      "sorte": "personne"
    }
  ],
  "etapes": [
    {
      "date": "2024-09-24",
      "libelle": "Eingereicht"
    },
    {
      "date": "2024-10-01",
      "libelle": "Überwiesen"
    }
  ],
  "documents": [
    {
      "titre": "Visionner le débat de ce point à l'ordre du jour",
      "date": "2024-10-01",
      "lien": "https://www.sonomix.ch/live/gcvd/2922#431"
    }
  ],
  "lien": "https://www.vd.ch/gc/seances-du-grand-conseil/point-seance/point/2cbe5ccf-f31e-4ac8-b55e-419efc401aeb/meeting/1026861",
  "communes": []
}
