{
  "version": 1,
  "genere": "2026-10-16T16:21:04Z",
  "id": 227791,
  "numero": "24_MOT_38",
  "type": "Motion",
  "statut": {
    "libelle": "Renvoyée à commission",
    "date": "2024-09-03"
  },
  "depose": "2024-09-03",
  "titre": "Les métiers de l'imprimerie se meurent...Agir ou laisser mourir ?",
  "contributeurs": [
    {
      "nom": "Nathalie Jaccard",
      "parti": "VER",
      "role": "Auteur",
      "sorte": "personne"
    },
    {
      "nom": "Cédric Weissert",
      "parti": "UDC",
      "role": "Rapporteur(s) de commission",
      "sorte": "personne"
    }
  ],
  "etapes": [
    {
      "date": "2024-09-03",
      "libelle": "Eingereicht"
    }
  ],
  "documents": [
    {
      "titre": "Visionner le débat de ce point à l'ordre du jour",
      "date": "2024-09-17",
      "lien": "https://www.sonomix.ch/live/gcvd/2914#1177"
    }
  ],
  "lien": "https://www.vd.ch/gc/seances-du-grand-conseil/point-seance/point/0476c2dd-5365-4c48-9357-3c7588c100f2/meeting/1026857",
  "communes": []
}
