{
  "version": 1,
  "genere": "2026-10-16T16:21:04Z",
  "id": 221527,
  "numero": "08_POS_087",
  "type": "Postulat",
  "statut": {
    "libelle": "Refusé",
    "date": "2009-02-10"
  },
  "depose": "2008-10-07",
  "titre": "Intitulé combattre activement la discrimination à l'embauche des migrant-e-s",
  "contributeurs": [
    {
      "nom": "Martine Fiora-Guttmann",
      "parti": "RAD",
      "role": "Rapporteur de la majorité de la commission",
      "sorte": "personne"
    },
    {
      "nom": "Martine Fiora-Guttmann",
      "parti": null,
      "role": null,
      "sorte": "groupe"
    },
    {
      "nom": "Cesla Amarelle",
      "parti": "SOC",
      "role": "Rapporteur de la minorité de la commission",
      "sorte": "personne"
    }
  ],
  "etapes": [
    {
      "date": "2008-10-07",
      "libelle": "Eingereicht"
    },
    {
      "date": "2008-10-07",
      "libelle": "Überwiesen"
    },
    {
      "date": "2009-02-10",
      "libelle": "Abgelehnt"
    }
  ],
  "documents": [
    {
      "titre": "Rapport de la minorité de la commission",
      "date": "2009-02-03",
      "lien": "https://www.vd.ch/fileadmin/user_upload/organisation/gc/Divers/08_POS_087_RC_min.pdf"
    },
    {
      "titre": "Rapport de la majorité de la commission",
      "date": "2009-02-03",
      "lien": "https://www.vd.ch/fileadmin/user_upload/organisation/gc/Seance_du_3_fevrier_2009/08_POS_087_RC_maj.pdf"
    },
    {
      "titre": "Objet et développement",
      "date": "2009-02-03",
      "lien": "https://www.vd.ch/fileadmin/user_upload/organisation/gc/Seance_du_3_fevrier_2009/08_POS_087_objet_et_dev.pdf"
    },
    {
      "titre": "Objet",
      "date": "2008-10-07",
      "lien": "https://www.vd.ch/fileadmin/user_upload/organisation/gc/Seance_du_7_octobre_2008/08_POS_87_Objet.pdf"
    }
  ],
  "lien": "https://www.vd.ch/gc/seances-precedentes/annee-2009/seance-du-10-fevrier-2009/postulat-jean-michel-dolivo",
  "communes": []
}
