{
  "version": 1,
  "genere": "2026-10-16T16:21:04Z",
  "id": 176466,
  "numero": "23_HQU_80",
  "type": "Question orale",
  "statut": {
    "libelle": "Terminée",
    "date": "2023-10-10"
  },
  "depose": "2023-10-03",
  "titre": "Des panneaux en plastique fleurissent dans notre canton",
  "contributeurs": [
    {
      "nom": "Alice Genoud",
      "parti": "VER",
      "role": "Auteur",
      "sorte": "personne"
    }
  ],
  "etapes": [
    {
      "date": "2023-10-03",
      "libelle": "Eingereicht"
    },
    {
      "date": "2023-10-10",
      "libelle": "Erledigt"
    }
  ],
  "documents": [],
  "lien": "https://www.vd.ch/gc/seances-du-grand-conseil/point-seance/point/1cc66faa-9e9b-4dab-b7b9-23269bebb964/meeting/1019543",
  "communes": []
}
