{
  "version": 1,
  "genere": "2026-10-16T16:21:04Z",
  "id": 226109,
  "numero": "22_HQU_1",
  "type": "Question orale",
  "statut": {
    "libelle": "Terminée",
    "date": "2022-01-25"
  },
  "depose": "2022-01-18",
  "titre": "Quelles suites cantonales à l’arrêt du Tribunal fédéral imposant le paiement des vacances et jours fériés en cas de RHT ?",
  "contributeurs": [
    {
      "nom": "David Raedler",
      "parti": "VER",
      "role": "Auteur",
      "sorte": "personne"
    }
  ],
  "etapes": [
    {
      "date": "2022-01-18",
      "libelle": "Eingereicht"
    },
    {
      "date": "2022-01-25",
      "libelle": "Erledigt"
    }
  ],
  "documents": [],
  "lien": "https://www.vd.ch/gc/seances-du-grand-conseil/point-seance/point/7fd7e5f5-4768-430a-bba7-a64f5a851ab7/meeting/1004428",
  "communes": []
}
