{
  "version": 1,
  "genere": "2026-10-17T05:02:22Z",
  "id": 224300,
  "numero": "18_INT_215",
  "type": "Interpellation",
  "statut": {
    "libelle": "Renvoyée au Conseil d'Etat",
    "date": "2018-08-28"
  },
  "depose": "2018-07-03",
  "titre": "Quelle est l'opportunité (et la légalité) de la décision prise en catimini par le Conseil d'Etat d'augmenter les impôts des propriétaires privés de logements locatifs ?",
  "contributeurs": [
    {
      "nom": "Guy-Philippe Bolay",
      "parti": "PLR",
      "role": "Auteur",
      "sorte": "personne"
    }
  ],
  "etapes": [
    {
      "date": "2018-07-03",
      "libelle": "Déposé"
    },
    {
      "date": "2018-08-28",
      "libelle": "Transférer"
    }
  ],
  "documents": [
    {
      "titre": "Objet",
      "date": "2018-08-28",
      "lien": "https://www.vd.ch/fileadmin/user_upload/organisation/gc/fichiers_pdf/2017-2022/18_INT_215_depot.pdf"
    }
  ],
  "lien": "https://www.vd.ch/gc/seances-precedentes/annee-2018/seance-du-mardi-28-aout-2018/interpellation-guy-philippe-bolay-quelle-est-lopportunite-et-la-legalite-de-la-decision-prise-en-catimini-par-le-conseil-detat-daugmenter-les-impots-des-proprietaires-prives-de-logements-locatifs",
  "communes": []
}
