{
  "version": 1,
  "genere": "2026-10-16T16:21:04Z",
  "id": 227214,
  "numero": "23_PET_7",
  "type": "Pétition",
  "statut": {
    "libelle": "Renvoyé par manque de temps",
    "date": "2023-10-03"
  },
  "depose": "2023-10-03",
  "titre": "Pétition aux autorités vaudoises pour demander l'arrêt immédiat des renvois forcés de femmes, enfants et personnes vulnérables",
  "contributeurs": [],
  "etapes": [
    {
      "date": "2023-10-03",
      "libelle": "Eingereicht"
    }
  ],
  "documents": [],
  "lien": "https://www.vd.ch/gc/seances-du-grand-conseil/point-seance/point/d38775e8-599d-40e0-922e-fb362e05ff9e/meeting/1026890",
  "communes": []
}
