{
  "version": 1,
  "genere": "2026-10-16T16:21:04Z",
  "id": 296055,
  "numero": "26_MOT_1",
  "type": "Motion",
  "statut": {
    "libelle": "Renvoyée à commission",
    "date": "2026-01-13"
  },
  "depose": "2026-01-13",
  "titre": "Délégation de tâches aux communes : un modèle à revoir ?",
  "contributeurs": [
    {
      "nom": "Alberto Mocchi",
      "parti": "VER",
      "role": "Auteur",
      "sorte": "personne"
    },
    {
      "nom": "Thanh-My Tran-Nhu",
      "parti": "SOC",
      "role": "Rapporteur(s) de commission",
      "sorte": "personne"
    }
  ],
  "etapes": [
    {
      "date": "2026-01-13",
      "libelle": "Eingereicht"
    }
  ],
  "documents": [],
  "lien": "https://www.vd.ch/gc/seances-du-grand-conseil/point-seance/point/45913cdf-5c9b-4a7e-82ab-0b16f32aaedb/meeting/1029654",
  "communes": []
}
