{
  "version": 1,
  "genere": "2026-10-16T16:21:04Z",
  "id": 29294,
  "numero": "INT20/037",
  "type": "Interpellation",
  "statut": {
    "libelle": "Décision : Prend acte",
    "date": "2024-03-19"
  },
  "depose": "2020-05-19",
  "titre": "Où en est l'économie lausannoise suite à la crise sanitaire ?",
  "contributeurs": [
    {
      "nom": "Fabrice Moscheni",
      "parti": "UDC",
      "role": "Auteur",
      "sorte": "personne"
    }
  ],
  "etapes": [
    {
      "date": "2020-05-19",
      "libelle": "Eingereicht"
    },
    {
      "date": "2024-02-23",
      "libelle": "Beantwortet"
    },
    {
      "date": "2024-03-19",
      "libelle": "Décision : Prend acte"
    }
  ],
  "documents": [
    {
      "titre": "06_22_fev_int_moscheni_economie_lausannoise_crise_sanitaire.pdf v1.0",
      "date": null,
      "lien": "https://www.lausanne.ch/apps/agir/affaire/doc/c4/c41b107b474f4867ab3a6d710c5b243e.pdf"
    },
    {
      "titre": "Délibéré 18e séance CC 2020 - SE - Résolutions - Interpellation urgente de Moscheni Fabrice et crts - Où en est l'économie lausannoise suite à la crise sanitaire ? - Renvoi Mpté",
      "date": null,
      "lien": "https://www.lausanne.ch/apps/agir/affaire/doc/d6/d6c2fe6130bd411384747d3aef0744e2.pdf"
    },
    {
      "titre": "Interpellation urgente de Moscheni Fabrice et crts - Où en est l'économie lausannoise suite à la crise sanitaire ?",
      "date": null,
      "lien": "https://www.lausanne.ch/apps/agir/affaire/doc/f1/f1eecec3f5a74897a37c023b441ae0dc.pdf"
    }
  ],
  "lien": "https://www.lausanne.ch/apps/agir/affaire/69/MIGRA-A368057-c6b13e1c274e369.htm",
  "communes": []
}
