{
  "version": 1,
  "genere": "2026-10-17T05:02:22Z",
  "id": 296056,
  "numero": "26_MOT_3",
  "type": "Motion",
  "statut": {
    "libelle": "Pris en considération",
    "date": "2026-06-09"
  },
  "depose": "2026-01-20",
  "titre": "Responsabilité des membres du Conseil d'Etat en lien avec l'affaire du bouclier fiscal",
  "contributeurs": [
    {
      "nom": "Ariane Morin",
      "parti": "VER",
      "role": "Auteur",
      "sorte": "personne"
    },
    {
      "nom": "Thanh-My Tran-Nhu",
      "parti": "SOC",
      "role": "Rapporteur(s) de commission",
      "sorte": "personne"
    }
  ],
  "etapes": [
    {
      "date": "2026-01-20",
      "libelle": "Déposé"
    },
    {
      "date": "2026-06-09",
      "libelle": "A l'ordre du jour"
    },
    {
      "date": "2026-06-09",
      "libelle": "Transférer"
    }
  ],
  "documents": [],
  "lien": "https://www.vd.ch/gc/seances-du-grand-conseil/point-seance/point/f71c4f50-4c3f-4d7d-8176-cb409c77e0fb/meeting/1029672",
  "communes": []
}
