{
  "version": 1,
  "genere": "2026-10-16T16:21:04Z",
  "id": 225167,
  "numero": "20_INT_454",
  "type": "Interpellation",
  "statut": {
    "libelle": "Adopté",
    "date": "2020-07-01"
  },
  "depose": "2020-02-25",
  "titre": "Cauchemars en cuisines vaudoises ?",
  "contributeurs": [
    {
      "nom": "Stéphane Montangero",
      "parti": "SOC",
      "role": "Auteur",
      "sorte": "personne"
    }
  ],
  "etapes": [
    {
      "date": "2020-02-25",
      "libelle": "Eingereicht"
    },
    {
      "date": "2020-03-03",
      "libelle": "Überwiesen"
    },
    {
      "date": "2020-07-01",
      "libelle": "Beantwortet"
    }
  ],
  "documents": [
    {
      "titre": "Objet",
      "date": "2020-03-03",
      "lien": "https://www.vd.ch/fileadmin/user_upload/organisation/gc/fichiers_pdf/2017-2022/20_INT_454_depot.pdf"
    },
    {
      "titre": "Visionner le débat de ce point à l'ordre du jour",
      "date": "2020-12-15",
      "lien": "https://www.sonomix.ch/live/gcvd/1686#9140"
    },
    {
      "titre": "Conditions d'hygiène et de santé dans le domaine de la restauration",
      "date": "2020-07-01",
      "lien": "https://sieldocs.vd.ch/ecm/app18/service/siel/getContent?ID=405631"
    }
  ],
  "lien": "https://www.vd.ch/gc/seances-du-grand-conseil/point-seance/point/16212601-af63-4b7c-acf5-a1e8cc94bf0e/meeting/1000539",
  "communes": []
}
