{
  "version": 1,
  "genere": "2026-10-17T05:02:22Z",
  "id": 225269,
  "numero": "20_LEG_227",
  "type": "Décret/Loi",
  "statut": {
    "libelle": "Adopté",
    "date": "2020-06-16"
  },
  "depose": "2020-06-16",
  "titre": "Exposé des motifs et projet de décret instituant une dispense d'assermentation pour les naturalisations",
  "contributeurs": [
    {
      "nom": "Jean-Claude Glardon",
      "parti": "SOC",
      "role": "Rapporteur de la commission",
      "sorte": "personne"
    },
    {
      "nom": "Jean-Claude Glardon",
      "parti": null,
      "role": null,
      "sorte": "groupe"
    },
    {
      "nom": "Jean-Claude Glardon",
      "parti": "SOC",
      "role": "Rapporteur de la commission",
      "sorte": "personne"
    }
  ],
  "etapes": [
    {
      "date": "2020-06-16",
      "libelle": "Déposé"
    },
    {
      "date": "2020-06-16",
      "libelle": "Adopté"
    }
  ],
  "documents": [
    {
      "titre": "Texte adopté par le Conseil d'Etat",
      "date": "2020-06-16",
      "lien": "https://www.vd.ch/fileadmin/user_upload/organisation/gc/fichiers_pdf/2017-2022/227_TexteCE.pdf"
    },
    {
      "titre": "Rapport de la commission",
      "date": "2020-06-16",
      "lien": "https://www.vd.ch/fileadmin/user_upload/organisation/gc/fichiers_pdf/2017-2022/227_RC.pdf"
    }
  ],
  "lien": "https://www.vd.ch/gc/seances-precedentes/annee-2020/seance-du-mardi-16-juin-2020/expose-des-motifs-et-projet-de-decret-instituant-une-dispense-dassermentation-pour-les-naturalisations",
  "communes": []
}
