{
  "version": 1,
  "genere": "2026-10-16T16:21:04Z",
  "id": 227963,
  "numero": "24_QUE_51",
  "type": "Simple question",
  "statut": {
    "libelle": "Beantwortet",
    "date": "2025-07-02"
  },
  "depose": "2024-06-25",
  "titre": "Violences homophobes et transphobes dans le post-obligatoire : ne prenons pas la question à la légère",
  "contributeurs": [
    {
      "nom": "Romain Pilloud",
      "parti": "SOC",
      "role": "Auteur",
      "sorte": "personne"
    }
  ],
  "etapes": [
    {
      "date": "2024-06-25",
      "libelle": "Eingereicht"
    },
    {
      "date": "2025-07-02",
      "libelle": "Eingereicht"
    },
    {
      "date": "2025-07-02",
      "libelle": "Beantwortet"
    }
  ],
  "documents": [
    {
      "titre": "Violences homophobes et transphobes dans le postobligatoire",
      "date": "2025-07-02",
      "lien": "https://sieldocs.vd.ch/ecm/app18/service/siel/getContent?ID=2314602"
    }
  ],
  "lien": "https://www.vd.ch/gc/seances-du-grand-conseil/point-seance/point/4f79091a-44d2-434f-82d0-ed3d1259e041/meeting/1019575",
  "communes": [
    {
      "ofs": 5401,
      "origine": "document"
    }
  ]
}
