{
  "version": 1,
  "genere": "2026-10-16T16:21:04Z",
  "id": 120229,
  "numero": "INT24/002",
  "type": "Interpellation",
  "statut": {
    "libelle": "Décision : Adoptée avec résolution",
    "date": "2024-05-21"
  },
  "depose": "2024-01-16",
  "titre": "Coupes de bois le long de la Vuachère, quelles raisons et quelle communication ?",
  "contributeurs": [
    {
      "nom": "Samuel De Vargas",
      "parti": "SOC",
      "role": "Auteur",
      "sorte": "personne"
    }
  ],
  "etapes": [
    {
      "date": "2024-01-16",
      "libelle": "Eingereicht"
    },
    {
      "date": "2024-01-16",
      "libelle": "Décision : Renvoi en Municipalité"
    },
    {
      "date": "2024-02-23",
      "libelle": "Beantwortet"
    },
    {
      "date": "2024-05-21",
      "libelle": "Décision : Adoptée avec résolution"
    }
  ],
  "documents": [
    {
      "titre": "Interpellation de de Vargas Samuel et crts - Coupes de bois le long de la Vuachère, quelles raisons et quelle communication ?",
      "date": null,
      "lien": "https://www.lausanne.ch/apps/agir/affaire/doc/ad/ad005c1a4c954ac99d63ca8460a7ab89.pdf"
    },
    {
      "titre": "Réponse à l'interpellation de de Vargas Samuel et crts - Coupes de bois le long de la Vuachère, quelles raisons et quelle communication ?",
      "date": null,
      "lien": "https://www.lausanne.ch/apps/agir/affaire/doc/d9/d9d34190186840af8a6741f6c115dbdc.pdf"
    },
    {
      "titre": "Délibéré 20e séance CC du 21.05.2024 - Résolution - Interpellation de de Vargas Samuel et crts - Coupes de bois le long de la Vuachère, quelles raisons et quelle communication",
      "date": null,
      "lien": "https://www.lausanne.ch/apps/agir/affaire/doc/b5/b53bb4a063c6487c94b9b580597312e3.pdf"
    }
  ],
  "lien": "https://www.lausanne.ch/apps/agir/affaire/4d/24ad108c98154d4c98e7e57e04242d4d.htm",
  "communes": []
}
